topic,language,title,url,content
global marketing strategy,en,The Definitive Guide to Global Marketing Strategy,https://www.wrike.com/blog/global-marketing-strategy-guide/,"Key takeaways:
What is a global marketing strategy? It's a comprehensive plan to expand a business internationally, incorporating localized marketing plans and the 4 Ps (Product, Pricing, Promotions, and Place).
Why is market research crucial? It helps understand cultural behaviors and channels in potential markets, ensuring tailored marketing strategies that avoid costly mistakes.
How should your marketing team be structured? Assemble a team with experience in target regions, considering local freelancers or agencies for effective execution.
What are the key benefits of a global marketing strategy? Increased brand awareness, improved product quality, competitive advantage, and lower marketing costs.
What are the challenges of a global marketing strategy? Compliance issues, market adaptation, and language barriers can complicate international marketing efforts."
global marketing strategy,en,What Are Global Marketing Strategies?,https://timespro.com/blog/what-are-global-marketing-strategies,"Businesses aiming to expand their reach beyond local markets must embrace global marketing strategies. These strategies are essential for companies looking to effectively tap into new international markets. Understanding and implementing global marketing strategies allows businesses to connect with diverse audiences, adapting their products and marketing messages to meet consumers' varied preferences and cultural nuances worldwide. 
This blog explores the expansive world of global marketing, offering insights into its definition, benefits, and the critical steps required for successful execution."
全球营销策略,cn,什么是全球营销？ 定义和策略,https://cn.smartling.com/blog/global-marketing,"吸引全球受众似乎是一个巨大的飞跃，但只要采用正确的全球营销策略，这个目标比以往任何时候都更容易实现。
可口可乐和百事可乐等品牌通过跨境提供一致的产品、信息和品牌，掌握了全球营销的艺术。 无论您是在巴黎还是在圣保罗品尝可口可乐，体验都是一样的。"
全球营销策略,cn,国际营销：2025 年顶级国际营销策略,https://share.foresightnews.pro/article/detail/83249,这是新的一年的开始，您的项目将在全球范围内实现跨越式发展。虽然拓展国际市场对于您的成长来说是令人兴奋的，但制定新的全球营销策略可能很复杂，而且容易出现代价高昂的错误，导致许多品牌采取谨慎行事的策略。制定经过充分研究和深思熟虑的国际营销策略对于您的业务路线图至关重要。
全球营销策略,cn,如何制定成功的全球营销战略,https://www.weglot.com/zh/guides/global-marketing-strategy,"地理边界已不再像过去那样令人望而生畏。在当今高度互联的世界里，地域界限几乎不复存在。得益于更加宽松的贸易法规，现在无论您身在何处，都可以比以往任何时候都更容易地扩大业务规模，实现全球扩张。
这并不是说这是一项不费吹灰之力的工作；如果你的目标是吸引全球受众，你就不能简单地依赖国内营销策略，而只是做一些调整。您必须通过研究各自的当地语言、人口和文化，为每个目标制定具体的营销计划。这些都将为您提供在这些地区展示和部署产品或服务的最佳方式。"
全球营销策略,cn,8 种有效的全球营销进入策略助力业务扩展,https://www.linguana.io/zh/blog/global-marketing-entry-strategies,在当今互联互通的世界里，企业不断寻求拓展海外市场的方法。然而，进入国外市场需要仔细规划和战略决策。在本文中，我们探讨了 8 种有效的全球营销进入策略，这些策略可以帮助企业驾驭国际市场并实现可持续增长。
全球营销策略,cn,企业出海时如何制定全球营销策略？,https://www.fxiaoke.com/crm/information-51564.html,企业在出海时制定全球营销策略的关键在于：一、进行深入的市场调研与分析；二、实施产品本地化策略；三、选择合适的渠道模式；四、采用多样化的营销传播手段。综合考虑以上因素，企业可以制定出科学、全面且灵活的全球营销策略，为成功进入海外市场奠定坚实基础。
thị trường ngoại hối,vn,Thị trường ngoại hối là gì? Lợi ích và rủi ro khi giao dịch ngoại hối,https://www.msb.com.vn/vi/w/ngoai-hoi-la-gi,"Ngoại hối là thuật ngữ không còn xa lạ với những nhà đầu tư tài chính. Nó được dùng để chỉ toàn bộ những phương thức thanh toán được sử dụng trên phạm vi toàn cầu. Nhưng với những người mới bắt đầu tìm hiểu thì thuật ngữ này còn khá xa lạ. Bài viết dưới đây, MSB sẽ giúp bạn hiểu ngoại hối là gì? Thị trường ngoại hối là gì? Có nên giao dịch ngoại hối hay không…"
thị trường ngoại hối,vn,Ngoại hối là gì? Tìm hiểu tất tần tật về thị trường ngoại hối,https://www.vpbank.com.vn/bi-kip-va-chia-se/corporate-story-and-tips/corporate-sat-category/ngoai-hoi-la-gi,"Giải thích ngoại hối là gì? Tìm hiểu về thị trường ngoại hối, các đặc điểm, cơ hội và rủi ro khi thực hiện giao dịch để đưa ra quyết định đầu tư thông minh."
thị trường ngoại hối,vn,Ngoại hối là gì? Cách phân biệt ngoại hối và ngoại tệ,https://techcombank.com/thong-tin/blog/ngoai-hoi-la-gi,"Ngoại hối là một thuật ngữ thường xuyên xuất hiện trong lĩnh vực tài chính, đặc biệt là trong giao dịch quốc tế. Tuy nhiên, nhiều người vẫn chưa thực sự phân biệt được ngoại hối với ngoại tệ. Để giúp bạn có cái nhìn rõ ràng hơn, bài viết này sẽ giải thích ngoại hối là gì, cách phân biệt giữa ngoại hối và ngoại tệ, và các thông tin hữu ích về thị trường ngoại hối."
thị trường ngoại hối,vn,Tìm hiểu thị trường giao dịch ngoại tệ và cách thức hoạt động,https://acb.com.vn/thu-vien/tim-hieu-thi-truong-giao-dich-ngoai-te-va-cach-thuc-hoat-dong,Thị trường giao dịch ngoại tệ là nơi giao dịch tiền tệ giữa các quốc gia khác nhau. Ngoại hối được xem là thị trường lớn và phát triển nhất trong các thị trường tài chính toàn cầu với hàng nghìn tỷ USD được giao dịch hàng ngày.
thị trường ngoại hối,vn,5 phút tìm hiểu tổng quan về thị trường ngoại hối mà bạn nên biết,https://www.pos365.vn/thi-truong-ngoai-hoi-7709.html,Ngoại hối hay Foreign exchange được hiểu là thị trường tài chính nơi các ngoại tệ của các quốc gia trên thế giới được tạo và trao đổi với nhau. Hay nói một cách dễ hiểu hơn thì ngoại hối là tài sản và quyền tài sản đã trải qua định giá và được chuyển thành tiền tệ quốc tế để một nước có thể được chấp nhận sử dụng thanh toán.
foreign exchange market,en,"Forex Market Explained: History, Mechanics, Pros & Cons",https://www.investopedia.com/terms/forex/f/foreign-exchange-markets.asp,"The foreign exchange market is the largest financial market in the world, operating 24 hours a day across a global network of financial centers, making it highly liquid and accessible for international trade and investments.
Forex markets are comprised of a diverse array of participants, including banks, commercial companies, central banks, hedge funds, and individual investors, each engaging in buying, selling, exchanging, and speculating on currency pairs.
Leverage is a unique feature of the forex market, allowing traders to magnify their exposure to currency movements, which can increase potential profits but also pose significant risk due to potentially high losses.
Forex markets operate with minimal oversight compared to other financial markets, offering both opportunities and risks to traders and investors due to lack of regulation and high volatility.
The history of the foreign exchange market traces back to ancient trade, evolving through significant events like the gold standard and the Bretton Woods system, ultimately leading to today's free-floating currency system."
foreign exchange market,en,The foreign exchange market model,https://www.khanacademy.org/economics-finance-domain/ap-macroeconomics/ap-macro-resources-and-exam-preparation/every-graph-used-in-ap-macroeconomics/a/the-foreign-exchange-market-model,Exchange rates are determined by the interaction of people who want to trade in their currency (the supply of a currency) with other people who want to obtain that currency (the demand for a currency). The foreign exchange model is a variation on a market model.
foreign exchange market,en,What is a foreign exchange market?,https://cb.is/knowledge-bank/educational-material/article/what-is-a-foreign-exchange-market,A foreign exchange market is an international platform where currencies are bought and sold. The role of foreign exchange markets is to facilitate and manage the exchange of foreign currency between those who want to buy and to sell currency. The exchange rate of individual currencies is determined by trading in the foreign exchange market.
foreign exchange market,en,Foreign Exchange Market,https://www.sciencedirect.com/topics/economics-econometrics-and-finance/foreign-exchange-market,"The foreign exchange market, or forex market, is defined as the market where currencies are traded, making it the largest financial market globally, with trillions of dollars exchanged daily. It operates as an over-the-counter market without a central marketplace, allowing for the simultaneous buying and selling of currency pairs, with trading occurring 24 hours a day, five days a week."
foreign exchange market,en,"Foreign exchange market (Forex, FX, or currency market)",https://www.ebsco.com/research-starters/business-and-management/foreign-exchange-market-forex-fx-or-currency-market,"The foreign exchange market, commonly known as Forex, FX, or the currency market, is a global decentralized platform for trading national currencies. It is recognized as the largest and most liquid financial market in the world, with daily trading volumes reaching approximately $5 trillion as of 2019. The market facilitates the exchange of currencies necessary for international trade, allowing businesses to transact across borders by converting their money into the required currency. Major participants include central banks, financial institutions, and multinational corporations, with individual traders accounting for a smaller portion of the activity."
外汇市场,cn,外汇市场,https://zh.wikipedia.org/wiki/%E5%A4%96%E6%B1%87%E5%B8%82%E5%9C%BA,外汇市场（英语：Foreign exchange market，简称：Forex、FX或currency market）是一个分散于全球各地用于交易货币的金融市场。除星期六、星期天和交易中心所在国家的重大节日外，世界各地的金融中心按所处位置轮流运转，使外汇市场能24小时不间断的买卖各种货币。按交易契约种类，有即期、掉期、也有远期合约等市场存在。外汇市场决定不同货币之间的汇率
外汇市场,cn,外汇市场,https://baike.baidu.com/item/%E5%A4%96%E6%B1%87%E5%B8%82%E5%9C%BA/2614,外汇市场是指在国际间从事外汇买卖，调剂外汇供求的交易场所。它的职能是经营货币商品，即不同国家的货币。由于各国货币制度不同，国际贸易、投资等活动产生的支付需求需通过货币兑换实现：本国货币需兑换外币用于海外支付，境外收入的外币也需兑换为本国货币流通
外汇市场,cn,个人外汇买卖常识—— 外汇知识篇,https://www.boc.cn/custserv/cs7/cs75/200808/t20080814_1278.html,通常指以外国货币表示的可用于国际结算的各种支付手段。包括：外国货币、外币存款、外币有价证券(政府公债、国库券、公司债券、股票等)、外币支付凭证(票据、银行存款凭证、邮政储蓄凭证等)。外汇是国际汇兑的简称。
外汇市场,cn,外汇新手入门教程,https://m.icbc.com.cn/icbc/%E7%83%AD%E7%82%B9%E7%AD%94%E7%96%91/%E6%8A%95%E8%B5%84%E7%90%86%E8%B4%A2/%E5%A4%96%E6%B1%87%E6%96%B0%E6%89%8B%E5%85%A5%E9%97%A8%E6%95%99%E7%A8%8B.htm,"一、认识外汇市场
　　（一）外汇汇率定义
　　外汇汇率是一国货币对外国货币的兑换率，取决于两国相互间的国际收支状况，或两国货币的购买力，在实际经验上，外汇汇率决定于两国间的长期经济因素，也是投资人预期的表现。
　　（二）外汇市场
　　外汇市场从广义上讲泛指外汇交易场所，包括个人外汇买卖场所，外币期货交易所等；从狭义上讲是指以外汇专业银行，外汇经纪商，中央银行等为交易主体，通过电话、电传、交易机等现代化通讯手段实现交易的交易市场；外汇市场既是一个有形的市场也是一个无形的市场，有形是指外汇交易市场有自己的地理位置，比如东京外汇市场、纽约外汇市场等；而无形则是表明市场并没有一个具体的范围，个人、机构、银行之间发生货币转化也可以无形中形成外汇市场。
　　国际上主要的外汇市场有：悉尼、东京、新加坡、香港、法兰克福、苏黎世、伦敦、纽约，由于以上各个城市地跨多个时区，工作时间基本上为当地时间的早9点到下午4点，因此基本上可以将一天24小时覆盖。"
外汇市场,cn,三个视角看外汇市场五年新变化,http://www.news.cn/fortune/20251104/21b83015997f4b579980c09acf8ee4a2/c.html,"创历史同期新高——国家外汇管理局10月22日公布的前三季度跨境收支规模数据引发市场广泛关注。
作为反映涉外经济活跃度的重要指标，中国跨境收支在“十四五”时期活力不断增强。2024年，中国跨境收支规模达到14万亿美元，较2020年增长64%，“十四五”时期年均增长速度比“十三五”时期提高8个百分点。今年前三季度，中国跨境收支总规模达11.6万亿美元，同比增长10.5%，跨境贸易和投融资活动持续活跃。从跨境收支到外汇市场交易，从服务外贸发展到助力企业“走出去”，“十四五”时期中国外汇市场都有哪些新变化？从三个视角来看——"